{"attempts":[{"conditioning":4.0,"family":"P1-E-low-thrust","group_id":"g4-group-v1-ee7b3293b0665c64ceb455602ddc297eb555b21dc1aa8e500d48c355c7f628d3","instance":"g4-instance-v2-81b59fbc0ca4c9242de017c4c442eb971a1d240e9673b748622f00ef17a00f84","intervals":500,"policy":"pure-gpu-ipm","quality_tier":"tight","quality_tolerance":1e-06,"repeat":0,"repeat_kind":"warmup","scaling_mode":"refresh_if_needed","seed":431,"solver_order":5,"statistics_eligible":false,"transfer_class":"combined","trust_class":1.0,"warm_mode":"primal"},{"conditioning":4.0,"family":"P1-E-low-thrust","group_id":"g4-group-v1-ee7b3293b0665c64ceb455602ddc297eb555b21dc1aa8e500d48c355c7f628d3","instance":"g4-instance-v2-81b59fbc0ca4c9242de017c4c442eb971a1d240e9673b748622f00ef17a00f84","intervals":500,"policy":"pure-gpu-ipm","quality_tier":"tight","quality_tolerance":1e-06,"repeat":1,"repeat_kind":"warmup","scaling_mode":"refresh_if_needed","seed":431,"solver_order":5,"statistics_eligible":false,"transfer_class":"combined","trust_class":1.0,"warm_mode":"primal"},{"conditioning":4.0,"family":"P1-E-low-thrust","group_id":"g4-group-v1-ee7b3293b0665c64ceb455602ddc297eb555b21dc1aa8e500d48c355c7f628d3","instance":"g4-instance-v2-81b59fbc0ca4c9242de017c4c442eb971a1d240e9673b748622f00ef17a00f84","intervals":500,"policy":"pure-gpu-ipm","quality_tier":"tight","quality_tolerance":1e-06,"repeat":0,"repeat_kind":"measured","scaling_mode":"refresh_if_needed","seed":431,"solver_order":5,"statistics_eligible":true,"transfer_class":"combined","trust_class":1.0,"warm_mode":"primal"},{"conditioning":4.0,"family":"P1-E-low-thrust","group_id":"g4-group-v1-ee7b3293b0665c64ceb455602ddc297eb555b21dc1aa8e500d48c355c7f628d3","instance":"g4-instance-v2-81b59fbc0ca4c9242de017c4c442eb971a1d240e9673b748622f00ef17a00f84","intervals":500,"policy":"pure-gpu-ipm","quality_tier":"tight","quality_tolerance":1e-06,"repeat":1,"repeat_kind":"measured","scaling_mode":"refresh_if_needed","seed":431,"solver_order":5,"statistics_eligible":true,"transfer_class":"combined","trust_class":1.0,"warm_mode":"primal"},{"conditioning":4.0,"family":"P1-E-low-thrust","group_id":"g4-group-v1-ee7b3293b0665c64ceb455602ddc297eb555b21dc1aa8e500d48c355c7f628d3","instance":"g4-instance-v2-81b59fbc0ca4c9242de017c4c442eb971a1d240e9673b748622f00ef17a00f84","intervals":500,"policy":"pure-gpu-ipm","quality_tier":"tight","quality_tolerance":1e-06,"repeat":2,"repeat_kind":"measured","scaling_mode":"refresh_if_needed","seed":431,"solver_order":5,"statistics_eligible":true,"transfer_class":"combined","trust_class":1.0,"warm_mode":"primal"},{"conditioning":4.0,"family":"P1-E-low-thrust","group_id":"g4-group-v1-ee7b3293b0665c64ceb455602ddc297eb555b21dc1aa8e500d48c355c7f628d3","instance":"g4-instance-v2-81b59fbc0ca4c9242de017c4c442eb971a1d240e9673b748622f00ef17a00f84","intervals":500,"policy":"pure-gpu-ipm","quality_tier":"tight","quality_tolerance":1e-06,"repeat":3,"repeat_kind":"measured","scaling_mode":"refresh_if_needed","seed":431,"solver_order":5,"statistics_eligible":true,"transfer_class":"combined","trust_class":1.0,"warm_mode":"primal"},{"conditioning":4.0,"family":"P1-E-low-thrust","group_id":"g4-group-v1-ee7b3293b0665c64ceb455602ddc297eb555b21dc1aa8e500d48c355c7f628d3","instance":"g4-instance-v2-81b59fbc0ca4c9242de017c4c442eb971a1d240e9673b748622f00ef17a00f84","intervals":500,"policy":"pure-gpu-ipm","quality_tier":"tight","quality_tolerance":1e-06,"repeat":4,"repeat_kind":"measured","scaling_mode":"refresh_if_needed","seed":431,"solver_order":5,"statistics_eligible":true,"transfer_class":"combined","trust_class":1.0,"warm_mode":"primal"},{"conditioning":4.0,"family":"P1-E-low-thrust","group_id":"g4-group-v1-ee7b3293b0665c64ceb455602ddc297eb555b21dc1aa8e500d48c355c7f628d3","instance":"g4-instance-v2-81b59fbc0ca4c9242de017c4c442eb971a1d240e9673b748622f00ef17a00f84","intervals":500,"policy":"pure-gpu-ipm","quality_tier":"tight","quality_tolerance":1e-06,"repeat":5,"repeat_kind":"measured","scaling_mode":"refresh_if_needed","seed":431,"solver_order":5,"statistics_eligible":true,"transfer_class":"combined","trust_class":1.0,"warm_mode":"primal"},{"conditioning":4.0,"family":"P1-E-low-thrust","group_id":"g4-group-v1-ee7b3293b0665c64ceb455602ddc297eb555b21dc1aa8e500d48c355c7f628d3","instance":"g4-instance-v2-81b59fbc0ca4c9242de017c4c442eb971a1d240e9673b748622f00ef17a00f84","intervals":500,"policy":"pure-gpu-ipm","quality_tier":"tight","quality_tolerance":1e-06,"repeat":6,"repeat_kind":"measured","scaling_mode":"refresh_if_needed","seed":431,"solver_order":5,"statistics_eligible":true,"transfer_class":"combined","trust_class":1.0,"warm_mode":"primal"}],"coordinate":{"conditioning":4.0,"family":"P1-E-low-thrust","intervals":500,"policy":"pure-gpu-ipm","quality_tier":"tight","quality_tolerance":1e-06,"scaling_mode":"refresh_if_needed","seed":431,"solver_order":5,"transfer_class":"combined","trust_class":1.0,"warm_mode":"primal"},"group_id":"g4-group-v1-ee7b3293b0665c64ceb455602ddc297eb555b21dc1aa8e500d48c355c7f628d3","physical_instance_id":"g4-instance-v2-81b59fbc0ca4c9242de017c4c442eb971a1d240e9673b748622f00ef17a00f84","process_contract":{"persistent_session":true,"persistent_workspace":true,"policy_reset_between_attempts":true,"processes":1},"record_kind":"execution_group","schema_version":"1.0.0"}
